Area,Label,Type,Parent,IMDQuintile,LocalCarePartnertship,Description
E01019886,East Devon 005A,LSOA,E07000040,3,Eastern,"LSOA covering East of Axminster: Milbrook, Hawkchurch and surrounding areas"
E01019887,East Devon 005B,LSOA,E07000040,3,Eastern,LSOA covering Axminster (East) and Foxhill
E01019888,East Devon 005C,LSOA,E07000040,3,Eastern,LSOA covering Axminster (Central and West)
E01019889,East Devon 005D,LSOA,E07000040,4,Eastern,LSOA covering Axminster (South)
E01019890,East Devon 009A,LSOA,E07000040,4,Eastern,"LSOA covering Beer, Branscombe, Vicarage and surrounding areas"
E01019891,East Devon 006A,LSOA,E07000040,3,Eastern,"LSOA covering North East of Exeter: Broadclyst (North), Clyst St Lawrence, Clyst Hydon, Westwood, Budlake and surrounding areas"
E01019892,East Devon 006B,LSOA,E07000040,4,Eastern,"LSOA covering North East of Exeter: Broadclyst (South), Poltimore, Dog Village and surrounding areas"
E01019893,East Devon 006C,LSOA,E07000040,3,Eastern,"LSOA covering East of Exeter: Rockbeare, Clyst Honiton, Marsh Green and surrounding areas"
E01019894,East Devon 017A,LSOA,E07000040,5,Eastern,LSOA covering Budleigh Salterton (East)
E01019895,East Devon 017B,LSOA,E07000040,5,Eastern,LSOA covering Budleigh Salterton (West) and Knowle
E01019896,East Devon 017C,LSOA,E07000040,5,Eastern,LSOA covering East Budleigh and surrounding areas
E01019897,East Devon 017D,LSOA,E07000040,3,Eastern,LSOA covering Budleigh Salterton (North)
E01019898,East Devon 014A,LSOA,E07000040,4,Eastern,"LSOA covering East of Exeter: Clyst St Mary, Sowton, Farringdon, Clyst St George, Ebford and surrounding areas"
E01019899,East Devon 007A,LSOA,E07000040,4,Eastern,LSOA covering Colyton
E01019900,East Devon 007B,LSOA,E07000040,5,Eastern,"LSOA covering Colyford, Northleigh and surrounding areas"
E01019901,East Devon 009B,LSOA,E07000040,3,Eastern,"LSOA covering Farway, Church Green, Southleigh, Offwell, Wilmington, Widworthy and surrounding areas"
E01019902,East Devon 001A,LSOA,E07000040,3,Eastern,"LSOA covering North of Honiton: Dunkeswell, Sheldon, Abbey, Combe Raleigh and surrounding areas"
E01019903,East Devon 006D,LSOA,E07000040,3,Eastern,"LSOA covering North of Exeter: Stoke Canon, Cowley, Brampford Speke, Upton Pyne, Rewe, Nether Exe, Up Exe and surrounding areas"
E01019904,East Devon 015A,LSOA,E07000040,3,Eastern,"LSOA covering Exmouth - Churchill Road, Fraser Road and Greenpark Road area"
E01019905,East Devon 015B,LSOA,E07000040,5,Eastern,LSOA covering Exmouth - Dinan Way and Bystock Road area
E01019906,East Devon 015C,LSOA,E07000040,5,Eastern,LSOA covering Exmouth - Pines Road area
E01019907,East Devon 015D,LSOA,E07000040,5,Eastern,LSOA covering Exmouth - Winston Road and Parkside Drive area
E01019908,East Devon 016A,LSOA,E07000040,4,Eastern,LSOA covering Exmouth - Byron Way area
E01019909,East Devon 016B,LSOA,E07000040,5,Eastern,LSOA covering Exmouth - Hulham Road area
E01019910,East Devon 016C,LSOA,E07000040,4,Eastern,"LSOA covering Exmouth - Gipsy Lane, College and Phear Park area"
E01019911,East Devon 016D,LSOA,E07000040,5,Eastern,LSOA covering Exmouth - Littlemead Lane area
E01019912,East Devon 020A,LSOA,E07000040,3,Eastern,LSOA covering Exmouth - Hospital area
E01019913,East Devon 020B,LSOA,E07000040,4,Eastern,LSOA covering Exmouth - University and Douglas Avenue area
E01019914,East Devon 020C,LSOA,E07000040,2,Eastern,LSOA covering Exmouth - Littleham
E01019915,East Devon 020D,LSOA,E07000040,4,Eastern,LSOA covering Exmouth - Salterton Road and Cranford Avenue area
E01019916,East Devon 019A,LSOA,E07000040,2,Eastern,LSOA covering Exmouth - Town Centre area
E01019917,East Devon 019B,LSOA,E07000040,3,Eastern,"LSOA covering Exmouth - Central, Exeter Road East (Madiera Villas area)"
E01019918,East Devon 019C,LSOA,E07000040,2,Eastern,"LSOA covering Exmouth - The Point, Docks and Victoria Road Area"
E01019919,East Devon 019D,LSOA,E07000040,2,Eastern,"LSOA covering Exmouth - Central, Exeter Road West (Church Road area)"
E01019920,East Devon 018A,LSOA,E07000040,3,Eastern,"LSOA covering Exmouth - Prince of Wales Drive, Superstore and Withycombe Brook area"
E01019921,East Devon 018B,LSOA,E07000040,4,Eastern,"LSOA covering Exmouth - Ashleigh Road, Richmond Road and Bradhams Lane area"
E01019922,East Devon 018C,LSOA,E07000040,2,Eastern,LSOA covering Exmouth - Moorfield Road area
E01019923,East Devon 018D,LSOA,E07000040,3,Eastern,LSOA covering Exmouth - The Marles and Pound Lane area
E01019924,East Devon 018E,LSOA,E07000040,3,Eastern,LSOA covering Exmouth - Liverton and Veiges area
E01019925,East Devon 004A,LSOA,E07000040,5,Eastern,LSOA covering Feniton
E01019927,East Devon 002A,LSOA,E07000040,2,Eastern,LSOA covering Honiton - Streamers Meadows and King Street areas near High Street
E01019928,East Devon 003A,LSOA,E07000040,3,Eastern,LSOA covering Honiton - Millhead Road area
E01019929,East Devon 003B,LSOA,E07000040,4,Eastern,LSOA covering Honiton - Honiton Bottom Road area
E01019930,East Devon 003C,LSOA,E07000040,4,Eastern,LSOA covering Honiton - Old Elm Road and Devonshire Road area
E01019931,East Devon 003D,LSOA,E07000040,5,Eastern,LSOA covering Honiton - Battishorne Way area
E01019932,East Devon 002B,LSOA,E07000040,2,Eastern,LSOA covering Honiton - Dowell Street/Northcott Lane area near High Street
E01019933,East Devon 002C,LSOA,E07000040,3,Eastern,LSOA covering Honiton - Langford Avenue/Marwood House area
E01019934,East Devon 002D,LSOA,E07000040,4,Eastern,LSOA covering Honiton - Kings Road/Pine Park Road area
E01019935,East Devon 007C,LSOA,E07000040,4,Eastern,"LSOA covering Kilmington (West), Dalwood, Shute and surrounding areas"
E01019936,East Devon 007D,LSOA,E07000040,3,Eastern,"LSOA covering Musbury, Whitford and surrounding areas"
E01019937,East Devon 013A,LSOA,E07000040,5,Eastern,"LSOA covering Newton Poppleford, Harpford, Southerton, Venn Ottery and surrounding areas"
E01019938,East Devon 001B,LSOA,E07000040,3,Eastern,"LSOA covering North East of Honiton: Cotleigh, Monkton, Stockland, Cotleigh, Rawridge, Upottery and surrounding areas"
E01019939,East Devon 008A,LSOA,E07000040,5,Eastern,"LSOA covering West Hill (West), Aylesbeare and surrounding areas"
E01019940,East Devon 008B,LSOA,E07000040,5,Eastern,"LSOA covering West Hill (East), Metcombe, Wiggaton, Tipton St John and surrounding areas"
E01019942,East Devon 008C,LSOA,E07000040,4,Eastern,LSOA covering Ottery St Mary (West)
E01019943,East Devon 008D,LSOA,E07000040,5,Eastern,LSOA covering Ottery St Mary (East)
E01019944,East Devon 008E,LSOA,E07000040,4,Eastern,LSOA covering Ottery St Mary (North)
E01019945,East Devon 013B,LSOA,E07000040,3,Eastern,"LSOA covering Woodbury Salterton, Otterton, Colaton Raleigh, Hawkerland, Yettington, Pinn and surrounding areas"
E01019946,East Devon 010A,LSOA,E07000040,5,Eastern,LSOA covering Seaton (West)
E01019947,East Devon 010B,LSOA,E07000040,3,Eastern,LSOA covering Seaton (Seafront)
E01019948,East Devon 010C,LSOA,E07000040,4,Eastern,LSOA covering Seaton - Harepath Road area
E01019949,East Devon 010D,LSOA,E07000040,5,Eastern,LSOA covering Seaton (North)
E01019950,East Devon 010E,LSOA,E07000040,3,Eastern,LSOA covering Seaton - Cricket Field area
E01019951,East Devon 009C,LSOA,E07000040,4,Eastern,"LSOA covering East Sidmouth, Salcombe Regis, Sidbury, Harcombe and surrounding areas"
E01019952,East Devon 011A,LSOA,E07000040,5,Eastern,LSOA covering Sidmouth - Sidford
E01019953,East Devon 011B,LSOA,E07000040,4,Eastern,LSOA covering Sidmouth - Newlands Road area
E01019954,East Devon 011C,LSOA,E07000040,3,Eastern,LSOA covering Sidmouth - Middle Woolbrook area
E01019955,East Devon 011D,LSOA,E07000040,4,Eastern,LSOA covering Sidmouth - Coulsdon Road area
E01019956,East Devon 012A,LSOA,E07000040,4,Eastern,LSOA covering Sidmouth - Town Centre area
E01019957,East Devon 012B,LSOA,E07000040,5,Eastern,LSOA covering Sidmouth - Cotmaton area
E01019958,East Devon 012C,LSOA,E07000040,5,Eastern,LSOA covering Sidmouth - Upper and Lower Woolbrook area
E01019959,East Devon 004D,LSOA,E07000040,3,Eastern,"LSOA covering Payhembury (East), Broadhembury, Awliscombe, Lower Cheriton and surrounding areas"
E01019960,East Devon 004E,LSOA,E07000040,4,Eastern,"LSOA covering Plymtree, Payhembury (West), Norman's Green, Higher Tale, Dulford, Kerswell and surrounding areas"
E01019961,East Devon 007E,LSOA,E07000040,4,Eastern,"LSOA covering Uplyme, Axmouth, Dowlands, Comboyne, Rousdon, Pinhay and surrounding areas"
E01019962,East Devon 004F,LSOA,E07000040,4,Eastern,"LSOA covering Whimple, Talaton and surrounding areas"
E01019963,East Devon 013C,LSOA,E07000040,5,Eastern,LSOA covering Woodbury
E01019964,East Devon 014B,LSOA,E07000040,5,Eastern,LSOA covering Exton and surrounding areas
E01019965,East Devon 014C,LSOA,E07000040,5,Eastern,LSOA covering Lympstone
E01019966,East Devon 005E,LSOA,E07000040,4,Eastern,"LSOA covering Tytherleigh, Chardstock, Churchill, Smallridge and surrounding areas"
E01019967,East Devon 001C,LSOA,E07000040,3,Eastern,"LSOA covering Membury, Furley, Yarcombe, Marsh and surrounding areas"
E01019968,Exeter 014A,LSOA,E07000041,4,Eastern,LSOA covering Alphington - Ide Lane & Aldens Road area
E01019969,Exeter 014B,LSOA,E07000041,4,Eastern,"LSOA covering Alphington - Church Road, Mill Lane and Marsh Barton area"
E01019970,Exeter 014C,LSOA,E07000041,4,Eastern,LSOA covering Alphington - Dawlish Road and Matford area
E01019971,Exeter 014D,LSOA,E07000041,3,Eastern,LSOA covering West Exe Quay area
E01019972,Exeter 014E,LSOA,E07000041,2,Eastern,LSOA covering Alphington Road - Ebrington Road area
E01019973,Exeter 012A,LSOA,E07000041,4,Eastern,"LSOA covering Cowick Lane - School, Allotments and Playing Field area"
E01019974,Exeter 012B,LSOA,E07000041,3,Eastern,LSOA covering Cowick - Barley Farm Road area
E01019975,Exeter 010A,LSOA,E07000041,2,Eastern,LSOA covering Cowick - Newman Road area
E01019976,Exeter 012C,LSOA,E07000041,4,Eastern,"LSOA covering Cowick - Crossmead, Cowick Hill and Dunsford Gardens area"
E01019977,Exeter 012D,LSOA,E07000041,4,Eastern,LSOA covering Cowick Lane - Franklyn Hospital area
E01019980,Exeter 005A,LSOA,E07000041,2,Eastern,LSOA covering Exwick - Farm Hill area
E01019981,Exeter 012E,LSOA,E07000041,2,Eastern,LSOA covering Exwick - Redhills area
E01019982,Exeter 005B,LSOA,E07000041,3,Eastern,"LSOA covering Exwick - Old Village, Cornflower Hill and St Andrews Road areas"
E01019983,Exeter 005C,LSOA,E07000041,5,Eastern,LSOA covering Exwick - Exwick Road area
E01019984,Exeter 005D,LSOA,E07000041,5,Eastern,LSOA covering Exwick - Gloucester Road area
E01019985,Exeter 005E,LSOA,E07000041,2,Eastern,LSOA covering Exwick - Cemetery area
E01019986,Exeter 007A,LSOA,E07000041,5,Eastern,LSOA covering Heavitree - Whipton Lane and Chard Road area
E01019987,Exeter 006A,LSOA,E07000041,3,Eastern,LSOA covering Heavitree - Fore Street area
E01019988,Exeter 013A,LSOA,E07000041,4,Eastern,LSOA covering Heavitree - St Loyes Road and Kingsway area
E01019989,Exeter 006B,LSOA,E07000041,4,Eastern,LSOA covering Heavitree - South Lawn Terrace area
E01019990,Exeter 002A,LSOA,E07000041,1,Eastern,LSOA covering Lancelot Road area
E01019991,Exeter 002B,LSOA,E07000041,2,Eastern,LSOA covering Beacon Heath area
E01019992,Exeter 003A,LSOA,E07000041,3,Eastern,LSOA covering Bennett Square and Woolsery Avenue area
E01019993,Exeter 002C,LSOA,E07000041,5,Eastern,LSOA covering Chancellors Way and Pinwood Meadow Drive area
E01019994,Exeter 008A,LSOA,E07000041,3,Eastern,LSOA covering Clifton Hill area
E01019995,Exeter 008B,LSOA,E07000041,1,Eastern,LSOA covering Sidwell Street and Clifton Road area
E01019996,Exeter 009A,LSOA,E07000041,3,Eastern,LSOA covering Magdalen Road area
E01019997,Exeter 004A,LSOA,E07000041,3,Eastern,LSOA covering Blackboy Road area
E01019998,Exeter 001C,LSOA,E07000041,5,Eastern,"LSOA covering Pennsylvania, Collins Road area"
E01019999,Exeter 001D,LSOA,E07000041,5,Eastern,LSOA covering Lower Pennsylvania
E01020000,Exeter 002D,LSOA,E07000041,2,Eastern,LSOA covering Stoke Hill
E01020001,Exeter 001E,LSOA,E07000041,5,Eastern,LSOA covering Upper Pennsylvania
E01020002,Exeter 003B,LSOA,E07000041,2,Eastern,LSOA covering Harrington Lane and Fox Road area
E01020003,Exeter 003C,LSOA,E07000041,4,Eastern,"LSOA covering Pinhoe, Church Hill and Main Road area"
E01020004,Exeter 003D,LSOA,E07000041,5,Eastern,LSOA covering Monkerton
E01020005,Exeter 003E,LSOA,E07000041,2,Eastern,LSOA covering Summerway area
E01020006,Exeter 006C,LSOA,E07000041,3,Eastern,LSOA covering Polsloe - Monks Road and Wykes Road area
E01020007,Exeter 002E,LSOA,E07000041,3,Eastern,LSOA covering Polsloe - Priory Road area
E01020008,Exeter 006D,LSOA,E07000041,4,Eastern,LSOA covering Polsloe - Commins Road area
E01020009,Exeter 006E,LSOA,E07000041,4,Eastern,LSOA covering Polsloe - Ladysmith School area
E01020010,Exeter 013B,LSOA,E07000041,2,Eastern,LSOA covering Burnthouse Lane area (Poets)
E01020011,Exeter 015A,LSOA,E07000041,4,Eastern,"LSOA covering Countess Wear, Higher Wear"
E01020012,Exeter 015B,LSOA,E07000041,2,Eastern,"LSOA covering Countess Wear, Lower Wear"
E01020013,Exeter 013C,LSOA,E07000041,2,Eastern,LSOA covering Wonford Hopital and Village area
E01020014,Exeter 013D,LSOA,E07000041,1,Eastern,LSOA covering Burnthouse Lane area (Rifford Road)
E01020015,Exeter 013E,LSOA,E07000041,1,Eastern,LSOA covering Burnthouse Lane area (Trees)
E01020016,Exeter 008C,LSOA,E07000041,1,Eastern,LSOA covering Cathedral and City Centre East
E01020017,Exeter 008D,LSOA,E07000041,2,Eastern,"LSOA covering St Davids, College and Station"
E01020018,Exeter 008E,LSOA,E07000041,1,Eastern,LSOA covering City Centre West
E01020019,Exeter 004B,LSOA,E07000041,4,Eastern,LSOA covering St James - Victoria Street area
E01020020,Exeter 004C,LSOA,E07000041,3,Eastern,LSOA covering St James - Football Ground area
E01020021,Exeter 004D,LSOA,E07000041,3,Eastern,LSOA covering Howell Road area
E01020022,Exeter 004E,LSOA,E07000041,2,Eastern,LSOA covering Longbrook Street area
E01020023,Exeter 009B,LSOA,E07000041,4,Eastern,LSOA covering St Leonards - Rivermead Road area
E01020024,Exeter 009C,LSOA,E07000041,5,Eastern,LSOA covering St Leonards - Matford Lane and St Leonards Road area
E01020025,Exeter 009D,LSOA,E07000041,3,Eastern,LSOA covering St Leonards - Mount Radford area
E01020026,Exeter 011A,LSOA,E07000041,5,Eastern,LSOA covering St Loyes - Broadfields area
E01020027,Exeter 011B,LSOA,E07000041,4,Eastern,LSOA covering St Loyes - Woodwater Lane area
E01020029,Exeter 010B,LSOA,E07000041,3,Eastern,LSOA covering St Thomas - Wardrew Road area
E01020030,Exeter 010C,LSOA,E07000041,2,Eastern,LSOA covering St Thomas - Cowick Street area
E01020031,Exeter 010D,LSOA,E07000041,3,Eastern,LSOA covering St Thomas - Rugby Ground area
E01020032,Exeter 010E,LSOA,E07000041,2,Eastern,LSOA covering St Thomas - Pinces Gardens area
E01020033,Exeter 015C,LSOA,E07000041,3,Eastern,LSOA covering Topsham - Newcourt Road and Exeter Road area
E01020035,Exeter 011D,LSOA,E07000041,4,Eastern,"LSOA covering Topsham Road, Southbrook Road area"
E01020036,Exeter 007B,LSOA,E07000041,2,Eastern,LSOA covering Hamlins Lane and Honeylands area
E01020037,Exeter 007C,LSOA,E07000041,1,Eastern,"LSOA covering Whipton, Hillyfield Road area"
E01020038,Exeter 011E,LSOA,E07000041,5,Eastern,LSOA covering Gallows Bridge Area
E01020039,Exeter 007D,LSOA,E07000041,1,Eastern,LSOA covering Whipton - Leypark Road and Bramley Avenue area
E01020040,Exeter 007E,LSOA,E07000041,3,Eastern,LSOA covering Sweetbrier Lane area
E01033232,Exeter 011F,LSOA,E07000041,4,Eastern,LSOA covering Exeter: Digby and Sowton - Kings Heath
E01033233,Exeter 001F,LSOA,E07000041,5,Eastern,LSOA covering Exeter: Duryard - University and West Garth Road areas
E01033234,Exeter 011G,LSOA,E07000041,5,Eastern,LSOA covering Exeter: Digby and Sowton - Clyst Heath and Sowton
E01033235,Exeter 015E,LSOA,E07000041,5,Eastern,LSOA covering Exeter: Topsham - High Street and Station Road areas
E01033236,Exeter 015F,LSOA,E07000041,5,Eastern,"LSOA covering Exeter: Topsham - Victoria Road, Monmouth Street and Mount Howe areas"
E01020041,Mid Devon 011A,LSOA,E07000042,2,Eastern,"LSOA covering Crediton: East Street, Park Road, Fordton and surrounding areas"
E01020042,Mid Devon 011B,LSOA,E07000042,5,Eastern,LSOA covering Crediton: East Town
E01020043,Mid Devon 008A,LSOA,E07000042,4,Eastern,"LSOA covering Bradninch, Hele and surrounding areas"
E01020044,Mid Devon 008B,LSOA,E07000042,4,Eastern,"LSOA covering Thorverton, Bickleigh, Cadeleigh, Cadbury, Well Town and surrounding areas"
E01020045,Mid Devon 006A,LSOA,E07000042,4,Eastern,LSOA covering Sampford Peverill and surrounding areas
E01020046,Mid Devon 001A,LSOA,E07000042,3,Eastern,"LSOA covering Clayhanger, Huntsham, Hockworthy, Holcombe Rogus, Westleigh and surrounding areas"
E01020047,Mid Devon 002A,LSOA,E07000042,4,Eastern,"LSOA covering Cove, Bolham, northern edge of Tiverton and surrounding area"
E01020048,Mid Devon 005A,LSOA,E07000042,2,Eastern,"LSOA covering Tiverton: Castle, Hospital and surrounding area"
E01020049,Mid Devon 001B,LSOA,E07000042,3,Eastern,"LSOA covering Oakford, Stoodleigh, Loxbeare, Washfield, Templeton, Templeton Bridge, Calverleigh, and surrounding areas"
E01020050,Mid Devon 001C,LSOA,E07000042,3,Eastern,"LSOA covering Bampton, Morebath, Shillingford, Petton and surrounding areas"
E01020051,Mid Devon 002B,LSOA,E07000042,4,Eastern,LSOA covering Tiverton: Tidcombe Hall and surrounding area
E01020052,Mid Devon 004A,LSOA,E07000042,2,Eastern,LSOA covering Tiverton: The Avenue and St Andrew Street area
E01020053,Mid Devon 004B,LSOA,E07000042,2,Eastern,LSOA covering Tiverton: Mackenzie Way area
E01020054,Mid Devon 007A,LSOA,E07000042,4,Eastern,"LSOA covering Cullompton (North), Kings Mill and Stoneyford"
E01020055,Mid Devon 007B,LSOA,E07000042,2,Eastern,LSOA covering Cullompton (Central)
E01020056,Mid Devon 008C,LSOA,E07000042,3,Eastern,"LSOA covering Area surrounding Cullompton including Kentisbeare, Butterleigh, Blackborough, and surrounding areas"
E01020057,Mid Devon 007C,LSOA,E07000042,2,Eastern,LSOA covering Cullompton (West)
E01020058,Mid Devon 007D,LSOA,E07000042,5,Eastern,LSOA covering Cullompton (South West)
E01020059,Mid Devon 006B,LSOA,E07000042,3,Eastern,"LSOA covering Halberton, Ash Thomas, Uplowman and surrounding areas"
E01020060,Mid Devon 011C,LSOA,E07000042,3,Eastern,LSOA covering Crediton: High Street and Deer Lane area
E01020061,Mid Devon 011D,LSOA,E07000042,4,Eastern,LSOA covering Crediton: West Town
E01020062,Mid Devon 006C,LSOA,E07000042,5,Eastern,LSOA covering Willand (South)
E01020063,Mid Devon 003A,LSOA,E07000042,3,Eastern,LSOA covering Uffculme and surrounding areas
E01020064,Mid Devon 006D,LSOA,E07000042,4,Eastern,LSOA covering Willand (North)
E01020065,Mid Devon 004C,LSOA,E07000042,2,Eastern,LSOA covering Tiverton: Cowleymoor and surrounding areas
E01020066,Mid Devon 002C,LSOA,E07000042,4,Eastern,"LSOA covering Tiverton (Lea Road area), East Mere, Chettiscombe, Chevicombe and surrounding areas"
E01020067,Mid Devon 004D,LSOA,E07000042,2,Eastern,LSOA covering Tiverton: Queensway and surrounding areas
E01020068,Mid Devon 010A,LSOA,E07000042,3,Eastern,"LSOA covering Newton St Cyres, Stockleigh Pomeroy, Little Silver, Shoebrooke, Efford and surrounding areas"
E01020069,Mid Devon 010B,LSOA,E07000042,3,Eastern,"LSOA covering North of Crediton: Sandford, Kennerleigh, East Village, Newbuildings, Upper Hellions and surrounding areas"
E01020070,Mid Devon 010C,LSOA,E07000042,2,Eastern,"LSOA covering Morchard Bishop, Black Dog, Puddington, Hele Barton, Woolfardisworthy and surrounding areas"
E01020071,Mid Devon 008D,LSOA,E07000042,4,Eastern,LSOA covering Silverton and surrounding areas
E01020072,Mid Devon 009A,LSOA,E07000042,3,Eastern,"LSOA covering Zeal Monochorum, Down St Mary, East Leigh, Coldridge, Nymet Rowland, Brushford and surrounding areas"
E01020073,Mid Devon 009B,LSOA,E07000042,2,Eastern,"LSOA covering Lapford, Chawleigh, Eastington, Filleigh and surrounding areas"
E01020074,Mid Devon 003B,LSOA,E07000042,4,Eastern,"LSOA covering Craddock, Culmstock, Ashill, Nicholashayne, southern fringes of Hemyock and surrounding areas"
E01020075,Mid Devon 003C,LSOA,E07000042,4,Eastern,"LSOA covering Hemyock, Bolham Water, Clayhidon, Rosemary Lane and surrounding areas"
E01020076,Mid Devon 009C,LSOA,E07000042,3,Eastern,"LSOA covering Bow, Coleford, Colebrooke, Hillerton, Nymet Tracey, Clannaborough Barton and surrounding areas"
E01020077,Mid Devon 001D,LSOA,E07000042,3,Eastern,"LSOA covering Cheriton Fitzpaine, Poughill, Upham, Way Village, Pennymoor, Cruwys Morchard and surrounding areas"
E01020078,Mid Devon 005B,LSOA,E07000042,2,Eastern,LSOA covering Tiverton: Leat Street and Church Street area
E01020079,Mid Devon 005C,LSOA,E07000042,2,Eastern,LSOA covering Tiverton: Upcott Meadow Road and Roundhill area
E01020080,Mid Devon 002D,LSOA,E07000042,4,Eastern,"LSOA covering Tiverton: Palmerston Park, Narrow Lane and Ashley Rise area"
E01020081,Mid Devon 005D,LSOA,E07000042,2,Eastern,"LSOA covering Tiverton - Broomhill area, Withleigh and surrounding areas"
E01020082,Mid Devon 009D,LSOA,E07000042,3,Eastern,"LSOA covering Cheriton Bishop, Hittisleigh, Yeoford and surrounding areas"
E01020083,Mid Devon 010D,LSOA,E07000042,3,Eastern,"LSOA covering South and West of Crediton: Copplestone, Knowle, Venny Tedburn, Uton, Hookway and surrounding areas"
E01020084,North Devon 012A,LSOA,E07000043,3,Northern,"LSOA covering Barnstaple - Bickington, Brynsworthy Park area"
E01020085,North Devon 012B,LSOA,E07000043,4,Northern,LSOA covering Barnstaple South West - Westermoore and Roundswell areas
E01020086,North Devon 012C,LSOA,E07000043,5,Northern,LSOA covering Bickington (West)
E01020087,North Devon 014A,LSOA,E07000043,2,Northern,"LSOA covering George Nympton, Bishop's Nympton, Knowstone, Anstey and surrounding areas"
E01020088,North Devon 006A,LSOA,E07000043,3,Northern,"LSOA covering North East of Barnstaple - Goodleigh, Bratton Fleming and surrounding areas"
E01020089,North Devon 005A,LSOA,E07000043,4,Northern,"LSOA covering Braunton Central - East Street, Hills View and Exeter Road areas"
E01020090,North Devon 004A,LSOA,E07000043,5,Northern,"LSOA covering Braunton East, Knowle, Winsham, Fullabrook and surrounding areas"
E01020091,North Devon 005B,LSOA,E07000043,4,Northern,LSOA covering Saunton and Homer Road area of Braunton
E01020092,North Devon 005C,LSOA,E07000043,5,Northern,"LSOA covering Braunton West - West Hill, Pixie Lane and Frog Lane areas"
E01020093,North Devon 005D,LSOA,E07000043,3,Northern,"LSOA covering Braunton South West - Towns End, North Street, Mill Stile, South Street areas"
E01020094,North Devon 008A,LSOA,E07000043,1,Northern,LSOA covering Barnstaple Town Centre
E01020095,North Devon 008B,LSOA,E07000043,2,Northern,LSOA covering Barnstaple - Richmond Street and Bicton Street area
E01020096,North Devon 009A,LSOA,E07000043,2,Northern,LSOA covering Barnstaple - Litchdon Street and Victoria Road areas
E01020097,North Devon 013A,LSOA,E07000043,2,Northern,"LSOA covering Chittlehampton, King's Nympton and surrounding areas"
E01020098,North Devon 014B,LSOA,E07000043,3,Northern,"LSOA covering Chulmleigh, Worlington, Burrington and surrounding areas"
E01020099,North Devon 002A,LSOA,E07000043,3,Northern,"LSOA covering Combe Martin West (Woodlands / Borough Street), Berrynarbor and surrounding areas"
E01020100,North Devon 002B,LSOA,E07000043,2,Northern,"LSOA covering Combe Martin East, Parracombe, Martinhoe and surrounding areas"
E01020101,North Devon 002C,LSOA,E07000043,3,Northern,LSOA covering Combe Martin Central
E01020102,North Devon 010A,LSOA,E07000043,4,Northern,LSOA covering Barnstaple - Westacott area
E01020103,North Devon 010B,LSOA,E07000043,1,Northern,LSOA covering Barnstaple - Forches Avenue Area
E01020104,North Devon 010C,LSOA,E07000043,2,Northern,LSOA covering Barnstaple - Whiddon Drive and Barton Road area
E01020105,North Devon 011A,LSOA,E07000043,4,Northern,LSOA covering Fremington West
E01020106,North Devon 011B,LSOA,E07000043,4,Northern,LSOA covering Yelland
E01020107,North Devon 011C,LSOA,E07000043,4,Northern,LSOA covering Fremington East and surrounding areas
E01020108,North Devon 004B,LSOA,E07000043,3,Northern,"LSOA covering Woolacombe, Trimstone, West Down and surrounding areas"
E01020109,North Devon 004C,LSOA,E07000043,4,Northern,"LSOA covering Georgeham, Croyde and surrounding areas"
E01020110,North Devon 005E,LSOA,E07000043,4,Northern,"LSOA covering Ashford, Chivenor, Wrafton, Heanton Punchardon and surrounding areas"
E01020111,North Devon 001A,LSOA,E07000043,1,Northern,LSOA covering Ilfracombe - College Area
E01020112,North Devon 001B,LSOA,E07000043,1,Northern,"LSOA covering Ilfracombe - High Street, Fore Street and Quay"
E01020113,North Devon 003A,LSOA,E07000043,1,Northern,LSOA covering Ilfracombe West - Wilder Road and Torrs Park
E01020114,North Devon 001C,LSOA,E07000043,2,Northern,LSOA covering Ilfracombe - Castle Hill and Hillsborough Road areas
E01020115,North Devon 001D,LSOA,E07000043,3,Northern,LSOA covering Ilfracombe East - Hele and  Chambercombe areas
E01020116,North Devon 003B,LSOA,E07000043,2,Northern,LSOA covering Ilfracombe - Furze Hill and Horne Park area
E01020117,North Devon 003C,LSOA,E07000043,3,Northern,"LSOA covering Ilfracombe South, Slade, Lincombe, Lee and surrounding areas"
E01020118,North Devon 003D,LSOA,E07000043,2,Northern,LSOA covering Ilfracombe - Lower Slade and Langleigh Road area
E01020119,North Devon 011D,LSOA,E07000043,3,Northern,"LSOA covering East of Bideford - Instow, Horwood, Newton Tracey and surrouding areas"
E01020120,North Devon 006B,LSOA,E07000043,4,Northern,"LSOA covering Landkey (North), Gunn and surrounding areas"
E01020121,North Devon 012D,LSOA,E07000043,3,Northern,"LSOA covering Landkey Town, Swimbridge, Cobbaton and surrounding areas"
