Area,Label,Type,Parent,IMDQuintile,LocalCarePartnertship,Description
E01020122,North Devon 012E,LSOA,E07000043,3,Northern,"LSOA covering Bishop's Tawton, Lake and surrounding areas"
E01020123,North Devon 009B,LSOA,E07000043,3,Northern,"LSOA covering Barnstaple - Lynhurst Avenue, Beechwood Avenue areas"
E01020124,North Devon 009C,LSOA,E07000043,4,Northern,LSOA covering Barnstaple - Sticklepath area
E01020125,North Devon 009D,LSOA,E07000043,5,Northern,"LSOA covering Barnstaple - Aviemore, Manor Park and Philip Avenue areas"
E01020126,North Devon 002D,LSOA,E07000043,2,Northern,LSOA covering Lynton and Lynmouth
E01020127,North Devon 006C,LSOA,E07000043,3,Northern,"LSOA covering North of Barnstaple - Muddiford, Kentisbury and surrounding areas"
E01020128,North Devon 010D,LSOA,E07000043,5,Northern,LSOA covering Barnstaple South East - Rumsam area
E01020129,North Devon 010E,LSOA,E07000043,2,Northern,"LSOA covering Barnstaple - Newport, St Johns Lane area"
E01020130,North Devon 010F,LSOA,E07000043,2,Northern,LSOA covering Barnstaple - Newport Road area
E01020131,North Devon 013B,LSOA,E07000043,2,Northern,"LSOA covering North Molton, Molland, Brayford and surrounding areas"
E01020132,North Devon 007A,LSOA,E07000043,4,Northern,"LSOA covering Barnstaple North West - Pottington, Bradiford and Pilton areas"
E01020133,North Devon 007B,LSOA,E07000043,4,Northern,LSOA covering Barnstaple North - Northfield Area
E01020134,North Devon 007C,LSOA,E07000043,2,Northern,LSOA covering Barnstaple East - Raleigh
E01020135,North Devon 013C,LSOA,E07000043,2,Northern,"LSOA covering South Molton - College, Mill Street, Poltimore Road areas"
E01020136,North Devon 013D,LSOA,E07000043,3,Northern,LSOA covering South Molton - South and West outskirts and Clapworthy
E01020137,North Devon 013E,LSOA,E07000043,3,Northern,LSOA covering South Molton Central and North East
E01020138,North Devon 014C,LSOA,E07000043,2,Northern,"LSOA covering Witheridge, Rackenford, Rose Ash, Romansleigh and surrounding areas"
E01020139,North Devon 007D,LSOA,E07000043,2,Northern,LSOA covering Barnstaple - St Georges Road area
E01020140,North Devon 008C,LSOA,E07000043,2,Northern,"LSOA covering Barnstaple East - Walton Way, Cemetery and Sunset Heights areas"
E01020141,North Devon 008D,LSOA,E07000043,1,Northern,LSOA covering Barnstaple East - Derby and Gorwell Road areas
E01020142,South Hams 006A,LSOA,E07000044,3,Western,"LSOA covering East Allington, Halwell, Loddiswell and surrounding areas"
E01020143,South Hams 006B,LSOA,E07000044,3,Southern,"LSOA covering West of Totnes - Harbertonford, Avonwick and surrounding areas"
E01020144,South Hams 001A,LSOA,E07000044,5,Western,LSOA covering East of Roborough (Northern fringes of Plymouth)
E01020145,South Hams 001B,LSOA,E07000044,3,Western,"LSOA covering North of Plymouth - Bickleigh, Roborough (North) and surrounding areas"
E01020146,South Hams 001C,LSOA,E07000044,4,Western,LSOA covering Woolwell North (Northern fringes of Plymouth)
E01020147,South Hams 008A,LSOA,E07000044,3,Western,"LSOA covering Bigbury, Aveton Gifford, Kingston and surrounding areas"
E01020148,South Hams 002A,LSOA,E07000044,3,Western,"LSOA covering North of Ivybridge - Lutton, Cornwood, Harford and surrounding areas"
E01020149,South Hams 001D,LSOA,E07000044,3,Western,"LSOA covering East of Plympton - Sparkwell, Lee Mill and surrounding areas"
E01020150,South Hams 006C,LSOA,E07000044,4,Southern,"LSOA covering Dartington, Cott and surrounding areas"
E01020151,South Hams 007A,LSOA,E07000044,5,Southern,"LSOA covering Dartmouth Townstal, Warfleet and surrounding areas"
E01020152,South Hams 007B,LSOA,E07000044,3,Southern,"LSOA covering Dartmouth - Town Centre, Victoria Road and Southtown areas"
E01020153,South Hams 004A,LSOA,E07000044,3,Southern,"LSOA covering Kingswear, Hillhead and surrounding areas"
E01020154,South Hams 007C,LSOA,E07000044,3,Southern,"LSOA covering Dartmouth North - Seymour Drive, Archway Drive and Naval College areas"
E01020155,South Hams 007D,LSOA,E07000044,2,Southern,LSOA covering Dartmouth West - Britannia Avenue area
E01020156,South Hams 004B,LSOA,E07000044,4,Southern,"LSOA covering East of Totnes - Stoke Gabriel, Berry Pomeroy and surrounding areas"
E01020157,South Hams 002B,LSOA,E07000044,3,Southern,"LSOA covering Areas around Buckfastleigh including Didworthy, Slaverton, Holne and surrrounding areas"
E01020158,South Hams 008B,LSOA,E07000044,4,Western,LSOA covering Modbury and Brownston
E01020159,South Hams 008C,LSOA,E07000044,3,Western,"LSOA covering South of Ivybridge - Ermington, Holbeton and surrounding areas"
E01020160,South Hams 002C,LSOA,E07000044,3,Western,"LSOA covering Ugborough, Bittaford and surrounding areas"
E01020161,South Hams 005A,LSOA,E07000044,3,Western,"LSOA covering Ivybridge Central - Town Centre, St Johns Road and Crescent Road areas"
E01020162,South Hams 005B,LSOA,E07000044,5,Western,LSOA covering Ivybridge East - Cole Land and St Peters Way Area
E01020163,South Hams 005C,LSOA,E07000044,5,Western,LSOA covering Ivybridge South West - Woolcombe Lane Area
E01020164,South Hams 005D,LSOA,E07000044,4,Western,"LSOA covering Ivybridge - College, Cole Lane and Brook Road areas"
E01020165,South Hams 005E,LSOA,E07000044,5,Western,LSOA covering Ivybridge West - Woodlands Park Primary School Area
E01020166,South Hams 005F,LSOA,E07000044,5,Western,LSOA covering Ivybridge West - Cleeve Drive Area
E01020167,South Hams 005G,LSOA,E07000044,5,Western,LSOA covering Ivybridge West - Langham Levels Area
E01020168,South Hams 010A,LSOA,E07000044,3,Western,LSOA covering Kingsbridge East - Southville and Dodbrook areas
E01020169,South Hams 010B,LSOA,E07000044,4,Western,LSOA covering Kingsbridge Town Centre and North
E01020170,South Hams 004C,LSOA,E07000044,4,Southern,"LSOA covering Marldon, Compton and surrounding areas"
E01020171,South Hams 009A,LSOA,E07000044,4,Western,"LSOA covering Newton Ferrers, Noss Mayo and surrounding areas"
E01020172,South Hams 012A,LSOA,E07000044,3,Western,"LSOA covering Malborough, Galmpton, Salcombe outskirts and surrounding areas"
E01020173,South Hams 012B,LSOA,E07000044,5,Western,LSOA covering Salcombe
E01020174,South Hams 011A,LSOA,E07000044,3,Southern,"LSOA covering South East of Kingsbridge - Sherford, South Pool, East Prawle and surrounding areas"
E01020175,South Hams 011B,LSOA,E07000044,3,Southern,"LSOA covering Stoke Fleming, Slapton, Strete and surrounding areas"
E01020176,South Hams 002D,LSOA,E07000044,4,Western,"LSOA covering South Brent - Station Road, Hillside and Moorland Park areas"
E01020177,South Hams 002E,LSOA,E07000044,3,Western,"LSOA covering South Brent - Noland Park, Plymouth Road and Totnes Road areas"
E01020178,South Hams 011C,LSOA,E07000044,3,Southern,"LSOA covering Chillington, Torcross, Kellaton, Start Point and surrounding areas"
E01020179,South Hams 012C,LSOA,E07000044,3,Western,"LSOA covering Churchstow, Thurlestone and surrounding areas"
E01020180,South Hams 003A,LSOA,E07000044,2,Southern,"LSOA covering Totnes East - Jubilee Road, Pathfields and Parker Way areas"
E01020181,South Hams 003B,LSOA,E07000044,3,Southern,"LSOA covering Totnes East - Bridgetown, Higher Westonfields and Dukes Road areas"
E01020182,South Hams 003C,LSOA,E07000044,3,Southern,LSOA covering Totnes West - Follaton Road and Smithfield areas
E01020183,South Hams 003D,LSOA,E07000044,2,Southern,LSOA covering Totnes Town Centre
E01020184,South Hams 003E,LSOA,E07000044,2,Southern,LSOA covering Totnes South West - Maudlin Road and Leechwell Street areas
E01020185,South Hams 009B,LSOA,E07000044,5,Western,LSOA covering Wembury East and Knighton
E01020186,South Hams 009C,LSOA,E07000044,5,Western,LSOA covering Wembury West and Heybrook Bay
E01020187,South Hams 009D,LSOA,E07000044,3,Western,"LSOA covering East of Plymstock - Brixton, Elburton and surrounding areas"
E01020188,South Hams 004D,LSOA,E07000044,3,Southern,"LSOA covering North West of Dartmouth - Dittisham, Ashprington, Blackawton and surrounding areas"
E01020189,South Hams 010C,LSOA,E07000044,2,Western,"LSOA covering Kingsbridge West, West Alvington and surrouding areas"
E01020190,South Hams 008D,LSOA,E07000044,4,Western,"LSOA covering Yealmpton, Dunstone and surrounding areas"
E01020191,Teignbridge 013A,LSOA,E07000045,3,Southern,"LSOA covering South West of Newton Abbot: Denbury (East), Torbryan, West Ogwell, East Ogwell and surrounding areas"
E01020192,Teignbridge 019A,LSOA,E07000045,4,Southern,LSOA covering South of Newton Abbot: Abbotkerswell and surrounding areas
E01020193,Teignbridge 019B,LSOA,E07000045,4,Southern,"LSOA covering Broadhempston, Forder Green, Woodland, Denbury (West) and surrounding areas"
E01020194,Teignbridge 013B,LSOA,E07000045,5,Southern,"LSOA covering Newton Abbot South - Ogwell Road, Abbotsridge Drive and surrounding areas"
E01020195,Teignbridge 017A,LSOA,E07000045,3,Southern,"LSOA covering Ashburton (East), Caton and surrounding areas"
E01020196,Teignbridge 017B,LSOA,E07000045,2,Southern,LSOA covering Ashburton (West)
E01020197,Teignbridge 017C,LSOA,E07000045,4,Southern,"LSOA covering Buckfast, Buckland in the Moor and surrounding areas"
E01020198,Teignbridge 017D,LSOA,E07000045,2,Southern,LSOA covering Buckfastleigh (North)
E01020199,Teignbridge 017E,LSOA,E07000045,2,Southern,LSOA covering Buckfastleigh (South)
E01020200,Teignbridge 011A,LSOA,E07000045,4,Southern,"LSOA covering Bishopsteignton (North), Luton and surrounding areas"
E01020201,Teignbridge 011B,LSOA,E07000045,4,Southern,LSOA covering Bishopsteignton (South) and surrounding areas
E01020202,Teignbridge 007A,LSOA,E07000045,3,Southern,LSOA covering Bovey Tracey (South)
E01020203,Teignbridge 004A,LSOA,E07000045,5,Southern,LSOA covering Bovey Tracey (East)
E01020204,Teignbridge 007B,LSOA,E07000045,3,Southern,LSOA covering Heathfield
E01020205,Teignbridge 003A,LSOA,E07000045,4,Southern,"LSOA covering Lustleigh, Brimley and surrounding areas"
E01020206,Teignbridge 004B,LSOA,E07000045,4,Southern,LSOA covering Bovey Tracey (West)
E01020207,Teignbridge 013C,LSOA,E07000045,3,Southern,LSOA covering West of Newton Abbot: Seale Hayne area
E01020208,Teignbridge 012A,LSOA,E07000045,3,Southern,LSOA covering Newton Abbot: Rosemary Avenue and Manor Road area
E01020209,Teignbridge 012B,LSOA,E07000045,3,Southern,LSOA covering Newton Abbot: Woodleigh Road area
E01020210,Teignbridge 012C,LSOA,E07000045,5,Southern,LSOA covering Newton Abbot: Coombeshead Road area
E01020211,Teignbridge 014A,LSOA,E07000045,1,Southern,LSOA covering Newton Abbot: Sandringham Road area
E01020212,Teignbridge 016A,LSOA,E07000045,2,Southern,LSOA covering Newton Abbot: Windsor Avenue area
E01020213,Teignbridge 016B,LSOA,E07000045,3,Southern,LSOA covering Newton Abbot: Shaldon Road and Swanborough Road area
E01020214,Teignbridge 016C,LSOA,E07000045,4,Southern,LSOA covering Newton Abbot: Laburnham Road and Ash Way area
E01020215,Teignbridge 016D,LSOA,E07000045,5,Southern,LSOA covering Newton Abbot: Fern Road area
E01020216,Teignbridge 015A,LSOA,E07000045,1,Southern,LSOA covering Newton Abbot: Broadlands area
E01020217,Teignbridge 014B,LSOA,E07000045,2,Southern,LSOA covering Newton Abbot : Station Road and Osborne Street area
E01020218,Teignbridge 014C,LSOA,E07000045,2,Southern,LSOA covering Newton Abbot: Central - Union Road and Halcyon Road area
E01020219,Teignbridge 012D,LSOA,E07000045,4,Southern,LSOA covering Newton Abbot: Knowles Hill area
E01020220,Teignbridge 004C,LSOA,E07000045,3,Southern,LSOA covering Chudleigh (West)
E01020221,Teignbridge 004D,LSOA,E07000045,3,Southern,LSOA covering Chudleigh (East) and surrounding areas
E01020222,Teignbridge 004E,LSOA,E07000045,5,Southern,LSOA covering Chudleigh (Central)
E01020223,Teignbridge 004F,LSOA,E07000045,3,Southern,"LSOA covering Chudleigh Knighton, Hennock and surrounding areas"
E01020224,Teignbridge 014D,LSOA,E07000045,3,Southern,LSOA covering Newton Abbot: Gloucester Road area
E01020225,Teignbridge 015B,LSOA,E07000045,2,Southern,LSOA covering Newton Abbot: St Leonards Road area
E01020226,Teignbridge 015C,LSOA,E07000045,3,Southern,LSOA covering Newton Abbot: South Road and College Road area
E01020227,Teignbridge 015D,LSOA,E07000045,3,Southern,LSOA covering Newton Abbot: Park Road and Forde Park area
E01020228,Teignbridge 006A,LSOA,E07000045,2,Southern,LSOA covering Dawlish: Seafront area
E01020229,Teignbridge 005A,LSOA,E07000045,2,Southern,LSOA covering Dawlish Warren and Cockwood
E01020230,Teignbridge 005B,LSOA,E07000045,3,Southern,LSOA covering Dawlish: Longlands and Wallace Avenue area
E01020231,Teignbridge 005C,LSOA,E07000045,3,Southern,LSOA covering Dawlish (East)
E01020232,Teignbridge 005D,LSOA,E07000045,3,Southern,LSOA covering Dawlish: Gatehouse Hill area
E01020233,Teignbridge 006B,LSOA,E07000045,4,Southern,LSOA covering Dawlish: Teignmouth Road area
E01020234,Teignbridge 006C,LSOA,E07000045,2,Southern,LSOA covering Dawlish: Coronation Avenue area
E01020235,Teignbridge 006D,LSOA,E07000045,3,Southern,LSOA covering Dawlish: Church Street area
E01020236,Teignbridge 007C,LSOA,E07000045,5,Southern,"LSOA covering Liverton West, Coldeast, Exeter Cross and surrounding areas"
E01020237,Teignbridge 007D,LSOA,E07000045,3,Southern,"LSOA covering Haytor Vale, Liverton, Ilsington, Sigford, Bickington and surrounding areas"
E01020238,Teignbridge 019C,LSOA,E07000045,4,Southern,LSOA covering Ipplepen (Inner)
E01020239,Teignbridge 019D,LSOA,E07000045,5,Southern,LSOA covering Ipplepen (Outer)
E01020240,Teignbridge 002A,LSOA,E07000045,4,Eastern,"LSOA covering Powderham, Exminster (South and Central) and surrounding areas"
E01020241,Teignbridge 002B,LSOA,E07000045,3,Eastern,"LSOA covering South of Exeter: Kenn, Kennford and surrounding areas"
E01020242,Teignbridge 002C,LSOA,E07000045,5,Eastern,LSOA covering South of Exeter: Exminster (North and East)
E01020243,Teignbridge 001A,LSOA,E07000045,3,Eastern,"LSOA covering South and West of Exeter: Ide, Dunchideock, Shillingford St George and surrounding areas"
E01020244,Teignbridge 002D,LSOA,E07000045,3,Eastern,LSOA covering Starcross and surrounding area
E01020245,Teignbridge 002E,LSOA,E07000045,4,Eastern,"LSOA covering Kenton, Ashcombe and surrounding area"
E01020246,Teignbridge 018A,LSOA,E07000045,3,Southern,"LSOA covering East of Newton Abbot: Combeinteignhead, Netherton, Haccombe, Coffinswell, Daccombe and surrounding areas"
E01020247,Teignbridge 018B,LSOA,E07000045,2,Southern,LSOA covering Kingskerswell (Central)
E01020248,Teignbridge 018C,LSOA,E07000045,4,Southern,"LSOA covering Kingskerswell (South), North Whilborough and surrounding areas"
E01020249,Teignbridge 018D,LSOA,E07000045,4,Southern,LSOA covering South East of Newton Abbot: Kingskerswell (North) and surrounding areas
E01020250,Teignbridge 009A,LSOA,E07000045,4,Southern,LSOA covering Kingsteignton: Tarrs Avenue area
E01020251,Teignbridge 011C,LSOA,E07000045,4,Southern,"LSOA covering Kingsteignton (North East), Ideford and surrounding areas"
E01020252,Teignbridge 009B,LSOA,E07000045,2,Southern,LSOA covering Kingsteignton: Greenhill Way area
E01020253,Teignbridge 009C,LSOA,E07000045,5,Southern,LSOA covering Kingsteignton: Rydon Road area
E01020254,Teignbridge 009D,LSOA,E07000045,2,Southern,LSOA covering Kingsteignton: Ley Lane area
E01020255,Teignbridge 009E,LSOA,E07000045,3,Southern,LSOA covering Kingsteignton: Broadway Road area
E01020256,Teignbridge 013D,LSOA,E07000045,3,Southern,LSOA covering North of Newton Abbot: Teigngrace and surrounding areas
E01020257,Teignbridge 009F,LSOA,E07000045,5,Southern,LSOA covering Kingsteignton: Sandygate and Firleigh Road area
E01020258,Teignbridge 003B,LSOA,E07000045,4,Eastern,"LSOA covering Moretonhampstead, Doccombe and surrounding areas"
E01020259,Teignbridge 003C,LSOA,E07000045,3,Southern,"LSOA covering Widecombe in the Moor, Manaton, Cator Court, Ponsworthy, Poundsgate, Lettaford and surrounding areas"
E01020260,Teignbridge 011D,LSOA,E07000045,4,Southern,LSOA covering Shaldon Central
E01020261,Teignbridge 011E,LSOA,E07000045,4,Southern,"LSOA covering Shaldon West and East, Stokeinteignhead and surrounding areas"
E01020262,Teignbridge 001B,LSOA,E07000045,2,Eastern,"LSOA covering West of Exeter: Whitestone, Longdown and surrounding areas"
E01020263,Teignbridge 001C,LSOA,E07000045,3,Eastern,"LSOA covering Tedburn St Mary, Pathfinder Village and surrounding areas"
E01020264,Teignbridge 010A,LSOA,E07000045,2,Southern,LSOA covering Teignmouth: Landscore Road area
E01020265,Teignbridge 008A,LSOA,E07000045,5,Southern,LSOA covering Teignmouth: Pellow Way and St Marys Road area
E01020266,Teignbridge 008B,LSOA,E07000045,5,Southern,LSOA covering Teignmouth: Buckeridge Road area
E01020267,Teignbridge 008C,LSOA,E07000045,4,Southern,LSOA covering Teignmouth: Haldon Avenue area
E01020268,Teignbridge 008D,LSOA,E07000045,4,Southern,LSOA covering Teignmouth: Woodway Road area
E01020269,Teignbridge 010B,LSOA,E07000045,1,Southern,LSOA covering Teignmouth: Town Centre and Seafront area
E01020270,Teignbridge 008E,LSOA,E07000045,4,Southern,LSOA covering Teignmouth: Moorview Drive area
E01020271,Teignbridge 010C,LSOA,E07000045,2,Southern,LSOA covering Teignmouth: Westbrook Avenue area
E01020272,Teignbridge 010D,LSOA,E07000045,2,Southern,LSOA covering Teignmouth: Hospital and Mill Lane area
E01020273,Teignbridge 003D,LSOA,E07000045,4,Eastern,"LSOA covering Bridford, Christow, Dunsford and surrounding area"
E01020274,Teignbridge 001D,LSOA,E07000045,3,Eastern,"LSOA covering Doddiscombsleigh, Trusham, Higher Ashton, Lower Ashton, Coombe and surrounding areas"
E01020275,Torridge 001A,LSOA,E07000046,2,Northern,LSOA covering Appledore
E01020276,Torridge 001B,LSOA,E07000046,3,Northern,"LSOA covering Appledore outskirts, Northam North East and surrounding areas"
E01020277,Torridge 004A,LSOA,E07000046,1,Northern,LSOA covering Bideford South East - Churchhill Road and Barton Tors area
E01020278,Torridge 004B,LSOA,E07000046,3,Northern,"LSOA covering Bideford Cliveden Road and Hillcrest Road areas, Weare Gifford, Woodtown and surrounding areas"
E01020279,Torridge 004C,LSOA,E07000046,2,Northern,LSOA covering Bideford East - Clifton Street and Broadlands area
E01020280,Torridge 003A,LSOA,E07000046,1,Northern,LSOA covering Bideford Town Centre
E01020281,Torridge 003B,LSOA,E07000046,4,Northern,LSOA covering Bideford West - Northdown Road and Lane Field Road areas
E01020282,Torridge 003C,LSOA,E07000046,2,Northern,LSOA covering Bideford - Victoria Park and Kingsley Road area
E01020283,Torridge 004D,LSOA,E07000046,3,Northern,LSOA covering Bideford South West - Atlantic Village and Moreton Park Road areas
E01020284,Torridge 004E,LSOA,E07000046,2,Northern,LSOA covering Bideford West - Devonshire Park and Ford Farm area
E01020285,Torridge 004F,LSOA,E07000046,2,Northern,LSOA covering Bideford South West - Pynes Lane area
E01020286,Torridge 009A,LSOA,E07000046,2,Northern,"LSOA covering Clawton, Northcott, Cross Green, Broadwoodwidger and surrounding areas"
E01020287,Torridge 007A,LSOA,E07000046,2,Northern,"LSOA covering Taddiport, Petrockstowe, Marland, Little Torrington and surrounding areas"
E01020288,Torridge 005A,LSOA,E07000046,2,Northern,"LSOA covering Woolsery, Clovelly, Buck's Cross, Ashmansworthy and surrounding areas"
E01020289,Torridge 009B,LSOA,E07000046,2,Northern,"LSOA covering Black Torrington, Cookbury, Sheepwash and surrounding areas"
E01020290,Torridge 009C,LSOA,E07000046,2,Northern,"LSOA covering Halwill Junction, Halwill, Ashwater, Virginstow and surrounding areas"
E01020291,Torridge 008A,LSOA,E07000046,2,Northern,"LSOA covering Bradworthy, Meddon, Welcombe and surrounding areas"
E01020292,Torridge 005B,LSOA,E07000046,2,Northern,LSOA covering Hartland and surrounding areas
E01020293,Torridge 008B,LSOA,E07000046,2,Northern,"LSOA covering Holsworthy South and East, Sutcombe, Chillsworthy, Hollacombe and surrounding areas"
E01020294,Torridge 008C,LSOA,E07000046,2,Northern,LSOA covering Holsworthy North and West (Trewyn / West Croft)
E01020295,Torridge 005C,LSOA,E07000046,3,Northern,"LSOA covering West of Bideford - Abbotsham, Parkham and surrounding areas"
E01020296,Torridge 005D,LSOA,E07000046,3,Northern,"LSOA covering South of Bideford - Monkleigh, Littleham, Frithelstock and surrounding areas"
E01020297,Torridge 001C,LSOA,E07000046,1,Northern,LSOA covering Northam Central (Fore Street and Dodwell Road area)
E01020298,Torridge 002A,LSOA,E07000046,4,Northern,"LSOA covering Northam South - Highfield, Cluden Road, Windmill Lane and Durrant Lane areas"
E01020299,Torridge 001D,LSOA,E07000046,3,Northern,"LSOA covering Northam North West - Golf Links Road, Richmond Park and Bay View Road areas"
E01020300,Torridge 002B,LSOA,E07000046,4,Northern,LSOA covering Bideford North West - Orchard Hill and Raleigh Hill areas
E01020301,Torridge 009D,LSOA,E07000046,3,Northern,"LSOA covering Shebbear, Newton St Petrock, Langtree and surrounding areas"
E01020302,Torridge 008D,LSOA,E07000046,2,Northern,"LSOA covering West of Holsworthy - Jewell's Cross, Pyworthy and surrounding areas"
E01020303,Torridge 007B,LSOA,E07000046,3,Northern,"LSOA covering Beaford, Dolton, Roborough and surrounding areas"
E01020304,Torridge 006A,LSOA,E07000046,3,Northern,"LSOA covering Great Torrington West - New Street, Mill Street and School Lane area"
E01020305,Torridge 006B,LSOA,E07000046,2,Northern,LSOA covering Great Torrington South - Well Street and Castle Hill area
E01020306,Torridge 006C,LSOA,E07000046,4,Northern,"LSOA covering Great Torrington - Hatchmoor Road, Kingsmead Drive and Burwood Road areas"
E01020307,Torridge 006D,LSOA,E07000046,2,Northern,"LSOA covering Great Torrington - Calf Street, East Street, Greenbank and surrounding areas"
E01020308,Torridge 007C,LSOA,E07000046,3,Northern,"LSOA covering High Bickington, St Giles in the Wood, Yarnscombe and surrounding areas"
E01020309,Torridge 008E,LSOA,E07000046,2,Northern,"LSOA covering Putford, Milton Damerel, Buckland Brewer and surrounding areas"
E01020310,Torridge 002C,LSOA,E07000046,2,Northern,LSOA covering Westward Ho! West and Buckleigh
E01020311,Torridge 007D,LSOA,E07000046,2,Northern,"LSOA covering Winkleigh, Riddlecombe, Hollocombe and surrounding areas"
E01020312,West Devon 007A,LSOA,E07000047,3,Western,LSOA covering Bere Ferrers and surrounding areas
E01020313,West Devon 007B,LSOA,E07000047,2,Western,LSOA covering Bere Alston
E01020314,West Devon 004A,LSOA,E07000047,2,Eastern,"LSOA covering Bridestowe, Sourton, Germansweek and surrounding areas"
E01020315,West Devon 007C,LSOA,E07000047,3,Western,"LSOA covering Buckland Monachorum, Yelverton (Hillsborough) and surrounding areas"
E01020316,West Devon 007D,LSOA,E07000047,5,Western,"LSOA covering Yelverton (South), Milton Combe, Crapstone and surrounding areas"
E01020317,West Devon 006A,LSOA,E07000047,4,Western,"LSOA covering Dousland, Meavy, Walkhampton and surrounding areas"
E01020318,West Devon 003A,LSOA,E07000047,4,Eastern,LSOA covering Chagford and surrounding areas
E01020319,West Devon 003B,LSOA,E07000047,3,Eastern,"LSOA covering Drewsteignton, Spreyton and surrounding areas"
E01020320,West Devon 001A,LSOA,E07000047,2,Eastern,"LSOA covering Jacobstowe, Exbourne, Sampford Courtenay, Monkokehampton, Broadwoodkelly and surrounding areas"
E01020321,West Devon 001B,LSOA,E07000047,2,Eastern,"LSOA covering Hatherleigh, Highampton, Meeth and surrounding areas"
E01020322,West Devon 001C,LSOA,E07000047,2,Eastern,"LSOA covering North West of Okehampton - Beaworthy, Northlew, Folly Gate and surrounding areas"
E01020323,West Devon 003C,LSOA,E07000047,2,Western,"LSOA covering Central Dartmoor - Princetown, Postbridge, Lydford and surrounding areas"
E01020324,West Devon 006B,LSOA,E07000047,3,Western,"LSOA covering Mary Tavy, Peter Tavy and surrounding areas"
E01020325,West Devon 004B,LSOA,E07000047,3,Western,"LSOA covering Lewtrenchard, Chillaton, Milton Abbot and surrounding areas"
E01020326,West Devon 001D,LSOA,E07000047,3,Eastern,LSOA covering North Tawton
E01020327,West Devon 002A,LSOA,E07000047,4,Eastern,LSOA covering Okehampton East - Crediton Road and Exeter Road areas
E01020328,West Devon 002B,LSOA,E07000047,2,Eastern,"LSOA covering Okehampton - Northfield Road, North Street and North Road areas"
E01020329,West Devon 002C,LSOA,E07000047,3,Eastern,"LSOA covering Okehampton South West - Hospital area, Belstone, Meldon and surrounding areas"
E01020330,West Devon 002D,LSOA,E07000047,2,Eastern,LSOA covering Okehampton Central
E01020331,West Devon 004C,LSOA,E07000047,3,Western,"LSOA covering West of Tavistock - Lamerton, Horsebridge and surrounding areas"
E01020332,West Devon 005A,LSOA,E07000047,3,Western,"LSOA covering Tavistock Central - West Street, Brook Street and Bannawell Street areas"
E01020333,West Devon 005B,LSOA,E07000047,4,Western,LSOA covering Tavistock North West - Old Launceston Road and Manor Area
E01020334,West Devon 005C,LSOA,E07000047,2,Western,"LSOA covering Tavistock South West - Callington Road, Plymouth Road and surrounding areas"
E01020335,West Devon 005D,LSOA,E07000047,3,Western,"LSOA covering Tavistock East - Down Road, Deer Park and Crelake Park areas"
E01020336,West Devon 005E,LSOA,E07000047,5,Western,LSOA covering Whitchurch and areas South East of Tavistock
E01020337,West Devon 005F,LSOA,E07000047,2,Western,"LSOA covering Tavistock North East, Kelly College and Rowden"
E01020338,West Devon 005G,LSOA,E07000047,3,Western,LSOA covering Tavistock South - Grenville Drive and Oak Road areas
E01020339,West Devon 003D,LSOA,E07000047,3,Eastern,"LSOA covering South Tawton, Taw Green, Sticklepath and surrounding areas"
E01020340,West Devon 004D,LSOA,E07000047,3,Western,"LSOA covering Lifton, Stowford and surrounding areas"
E01020341,West Devon 006C,LSOA,E07000047,4,Western,LSOA covering Areas South East of Tavistock including parts of Horrabridge and Yelverton (Harrowbeer)
